UserID,PostID,Content,PostDate,Likes,Retweets,Replies,Engagement
1,TW001,Just finished reading an amazing book on leadership! #Leadership #Growth,2025-01-15,18,7,4,5.2
1,TW002,Excited about the upcoming industry conference! #Networking #Professional,2025-01-14,15,5,3,4.1
2,TW003,Great meeting with potential clients today!,2025-01-15,12,4,2,3.2
2,TW004,Sharing some productivity tips that work for me,2025-01-13,14,3,2,3.8
3,TW005,Industry trends we should all be watching #Innovation,2025-01-16,32,12,8,8.9
3,TW006,Collaboration is key to success in any field,2025-01-15,28,9,6,7.5
